{
  "$schema": "https://json-schema.org/draft/2020-12/schema",
  "title": "flow plugin — per-repo config",
  "description": "Per-repo configuration consumed by the flow plugin's commands, skills, and subagents. Place at <repo>/.ai/workflows.config.json. Missing file = defaults; missing keys = same.",
  "type": "object",
  "additionalProperties": false,
  "required": ["name"],
  "properties": {
    "$schema": {
      "type": "string",
      "description": "Pointer to this schema (editor support). Stripped at consumption time."
    },
    "name": {
      "type": "string",
      "description": "Short project / product name. Resolves the `<project>` placeholder in commands and file paths (e.g. `.ai/<project>-prd.md` → `.ai/<name>-prd.md`)."
    },
    "language": {
      "type": "string",
      "description": "Primary language used in plans, decisions, and review notes. ISO 639-1 (e.g. `en`, `cs`). Cosmetic — does not change plugin behaviour, only signals the team's preferred tone.",
      "default": "en"
    },
    "theme": {
      "type": "string",
      "enum": ["dark", "light", "agnostic"],
      "description": "Default theme target. `dark` and `light` enable theme-first contrast validation in a11y-rules; `agnostic` checks both.",
      "default": "agnostic"
    },
    "paths": {
      "type": "object",
      "additionalProperties": false,
      "description": "Where to find canonical project context files. Defaults follow `<project>` placeholder convention.",
      "properties": {
        "prd": {
          "type": "string",
          "description": "Project requirements / product brief. Default: `.ai/<name>-prd.md`."
        },
        "designSystem": {
          "type": "string",
          "description": "Design system reference. Default: `.ai/<name>-design-system.md`."
        },
        "codebaseMap": {
          "type": "string",
          "description": "Living codebase snapshot. Default: `.ai/context/codebase-map.md`.",
          "default": ".ai/context/codebase-map.md"
        }
      }
    },
    "platforms": {
      "type": "array",
      "description": "Platform variants the project ships to. Drives scenario-runner matrix and responsive-rules density mapping.",
      "items": {
        "type": "string",
        "enum": [
          "web-desktop",
          "web-mobile",
          "ios-phone",
          "ios-tablet",
          "android-phone",
          "android-tablet",
          "macos",
          "windows",
          "linux"
        ]
      },
      "default": ["web-desktop"],
      "uniqueItems": true
    },
    "bundleIdPrefix": {
      "type": "string",
      "description": "Native app bundle ID prefix (e.g. `com.acme.myapp`). Used by `/flow:utils-verify` and `/flow:scenario` when launching native builds. Omit for web-only projects."
    },
    "stack": {
      "type": "object",
      "additionalProperties": false,
      "description": "Auto-detected technology stack snapshot. Populated by /flow:init, refreshed by /flow:setup-codebase-map. Flow commands read this for routing decisions (e.g. which test runner to invoke, whether to gate on monorepo workspace builds). Use `unknown` when detection fails — never invent a value.",
      "properties": {
        "language": {
          "type": "string",
          "description": "Primary language: typescript | javascript | python | go | rust | java | kotlin | swift | ruby | php | unknown"
        },
        "framework": {
          "type": "string",
          "description": "Primary UI/app framework: next.js | vite | remix | sveltekit | astro | nuxt | expo | spring-boot | django | rails | express | fastapi | none | unknown"
        },
        "packageManager": {
          "type": "string",
          "description": "pnpm | yarn | npm | bun | cargo | go | pip | poetry | uv | maven | gradle | unknown"
        },
        "buildTool": {
          "type": "string",
          "description": "turbo | nx | lerna | rush | make | bazel | none | unknown"
        },
        "monorepo": {
          "type": "boolean",
          "description": "True if pnpm-workspace.yaml, turbo.json, nx.json, lerna.json, or rush.json is present."
        },
        "ci": {
          "type": "string",
          "description": "github-actions | gitlab-ci | jenkins | azure-devops | circleci | bitbucket | none | unknown"
        },
        "tests": {
          "type": "string",
          "description": "vitest | jest | playwright | cypress | rspec | pytest | go-test | cargo-test | junit | none | unknown"
        },
        "css": {
          "type": "string",
          "description": "tailwind | css-modules | styled-components | emotion | vanilla-extract | sass | plain-css | none | unknown"
        },
        "router": {
          "type": "string",
          "description": "next-app | next-pages | react-router | tanstack-router | expo-router | sveltekit-router | none | unknown"
        }
      }
    },
    "conventions": {
      "type": "object",
      "additionalProperties": false,
      "description": "Team conventions that flow commands enforce or display. Auto-detected where possible (e.g. `commits` from commitlint.config.*); otherwise asked once in /flow:init. Document non-obvious 'why' in `.ai/decisions/` as DDRs.",
      "properties": {
        "branchingModel": {
          "type": "string",
          "enum": ["github-flow", "trunk-based", "gitflow", "release-branch", "other"],
          "description": "How feature branches relate to main. Drives /flow:done's push + PR behavior."
        },
        "commits": {
          "type": "string",
          "enum": ["conventional", "gitmoji", "free-form"],
          "default": "conventional",
          "description": "Commit message style. /flow:done formats commits to match."
        },
        "prohibited": {
          "type": "array",
          "items": { "type": "string" },
          "default": [],
          "description": "Packages, libraries, or APIs the project rejects (e.g. `lodash` because we use native ES; `moment` because we use date-fns). Flow commands flag accidental introduction."
        },
        "proxy": {
          "type": "string",
          "description": "Network constraint that commands must respect (e.g. `GODEBUG=x509negativeserial=1` for orgs with old certs)."
        }
      }
    },
    "boundaries": {
      "type": "object",
      "additionalProperties": false,
      "description": "Integration boundaries the project crosses. debugging-rules and testing-rules treat these as no-mock zones and demand evidence at the seam.",
      "properties": {
        "realtime": { "type": "array", "items": { "type": "string" }, "default": [] },
        "video": { "type": "array", "items": { "type": "string" }, "default": [] },
        "api": { "type": "array", "items": { "type": "string" }, "default": [] },
        "db": { "type": "array", "items": { "type": "string" }, "default": [] },
        "auth": { "type": "array", "items": { "type": "string" }, "default": [] },
        "telemetry": { "type": "array", "items": { "type": "string" }, "default": [] },
        "payments": { "type": "array", "items": { "type": "string" }, "default": [] }
      }
    },
    "motion": {
      "type": "object",
      "additionalProperties": false,
      "description": "Motion duration budgets in milliseconds. motion-rules enforces these as hard ceilings.",
      "properties": {
        "micro": {
          "type": "integer",
          "minimum": 0,
          "default": 300,
          "description": "Hover, focus, tooltip, icon swap."
        },
        "page": {
          "type": "integer",
          "minimum": 0,
          "default": 500,
          "description": "Route transition, modal open."
        },
        "complex": {
          "type": "integer",
          "minimum": 0,
          "default": 1000,
          "description": "Multi-step orchestrations, hero choreography."
        },
        "customPulses": {
          "type": "object",
          "description": "Named long-running ambient animations (e.g. `liveIndicator: 1500`). Exempt from the page/complex caps because they're loops, not transitions.",
          "additionalProperties": { "type": "integer", "minimum": 0 },
          "default": {}
        }
      }
    },
    "responsive": {
      "type": "object",
      "additionalProperties": false,
      "description": "Responsive layout knobs. responsive-rules reads this to enforce density-per-platform.",
      "properties": {
        "approach": {
          "type": "string",
          "enum": ["mobile-first", "desktop-first"],
          "default": "mobile-first"
        },
        "densityMap": {
          "type": "object",
          "description": "Maps each entry in `platforms` to a density preset (`command-center` | `sideline-tool` | `palm-friendly` | `cozy` | `compact` | custom). responsive-rules uses this to flag wrong density per platform.",
          "additionalProperties": { "type": "string" },
          "default": {}
        },
        "breakpoints": {
          "type": "object",
          "description": "Named breakpoint tokens (px). Override only if project differs from defaults.",
          "additionalProperties": { "type": "integer", "minimum": 0 },
          "default": { "sm": 480, "md": 768, "lg": 1024, "xl": 1280, "2xl": 1536 }
        }
      }
    },
    "ux": {
      "type": "object",
      "additionalProperties": false,
      "description": "UX hard targets surfaced to design-system-guard and any project-local UX critic.",
      "properties": {
        "responseTargetMs": {
          "type": "integer",
          "minimum": 0,
          "default": 100,
          "description": "User-perceived response time ceiling for primary interactions."
        },
        "bilingual": {
          "type": "array",
          "items": { "type": "string" },
          "default": [],
          "description": "ISO 639-1 codes the UI ships in (e.g. `[\"cs\", \"en\"]`). Empty = monolingual."
        }
      }
    },
    "security": {
      "type": "object",
      "additionalProperties": false,
      "description": "Security review knobs. security-auditor + ethical-hacker subagents read these. Skip the whole pass with skills.securityRules.enabled = false.",
      "properties": {
        "severityFloor": {
          "type": "string",
          "enum": ["low", "medium", "high", "critical"],
          "default": "medium",
          "description": "Lowest severity that blocks /flow:validate step 6.5 and /flow:validate-security. Findings below this rate as warnings, not blockers."
        },
        "scope": {
          "type": "array",
          "items": { "type": "string", "enum": ["classic", "ai", "supply-chain"] },
          "default": ["classic", "ai", "supply-chain"],
          "description": "Which rule families to evaluate. Drop \"ai\" if the project has no model / MCP surface; drop \"supply-chain\" for projects with no third-party deps."
        },
        "includeAi": {
          "type": "boolean",
          "default": true,
          "description": "Shortcut to enable/disable §B AI-era rules in security-rules skill. When false, ethical-hacker still threat-models classic surface but the mandatory AI/MCP section reads \"N/A — disabled by config\"."
        }
      }
    },
    "skills": {
      "type": "object",
      "additionalProperties": false,
      "description": "Per-skill toggles. Each enforcement skill respects its own `enabled` flag (default `true`).",
      "properties": {
        "motionRules": {
          "type": "object",
          "properties": { "enabled": { "type": "boolean", "default": true } },
          "additionalProperties": false
        },
        "responsiveRules": {
          "type": "object",
          "properties": { "enabled": { "type": "boolean", "default": true } },
          "additionalProperties": false
        },
        "a11yRules": {
          "type": "object",
          "properties": { "enabled": { "type": "boolean", "default": true } },
          "additionalProperties": false
        },
        "testingRules": {
          "type": "object",
          "properties": { "enabled": { "type": "boolean", "default": true } },
          "additionalProperties": false
        },
        "debuggingRules": {
          "type": "object",
          "properties": { "enabled": { "type": "boolean", "default": true } },
          "additionalProperties": false
        },
        "securityRules": {
          "type": "object",
          "properties": { "enabled": { "type": "boolean", "default": true } },
          "additionalProperties": false
        },
        "coverageTrend": {
          "type": "object",
          "description": "Optional coverage-trend warning in /flow:validate. Opt-in — disabled by default, because not every project has a stable coverage signal worth gating on. When enabled, /flow:validate parses the current run's coverage and compares against `.ai/state/coverage-baseline.json`; a drop greater than `warnThresholdPp` percentage points emits a soft warning (never blocks). Baseline is refreshed by /flow:done after a green run.",
          "additionalProperties": false,
          "properties": {
            "enabled": { "type": "boolean", "default": false },
            "warnThresholdPp": {
              "type": "number",
              "description": "Percentage-point drop that triggers the warning. e.g. `1.0` means a 1-point drop (78% → 77%) warns.",
              "default": 1.0,
              "minimum": 0
            },
            "baselineBranch": {
              "type": "string",
              "description": "Branch whose coverage is considered authoritative. /flow:done writes the baseline only when the active branch matches this value (typically `main`).",
              "default": "main"
            }
          }
        }
      }
    },
    "quality": {
      "type": "object",
      "description": "Map of gate name → shell command string. Gate names are free-form (conventional names: `lint`, `format`, `typecheck`, `tests`, `build`). Each command is executed as-is via `eval` by the slash command that consumes the gate. Missing gate → slash command emits a one-line warning and skips (never fabricates a command). v1 deliberately keeps this a flat string map — no per-gate object shape, no `order`, no `scope`. Populate via `maude doctor --fix`, which detects from `package.json` scripts + tool presence. Existing user values are never overwritten — additions only.",
      "additionalProperties": {
        "type": "string",
        "minLength": 1
      }
    },
    "integrations": {
      "type": "object",
      "additionalProperties": false,
      "description": "Lightweight pointers to external services the project plugs into. Generic commands read `provider` and decide whether to offer integration actions; project-specific shape (list IDs, custom field names, milestone hierarchies) lives in `defaults`. Document non-obvious conventions in `.ai/decisions/` as DDRs.",
      "properties": {
        "tracker": {
          "type": "object",
          "additionalProperties": false,
          "description": "Issue / task tracker. Used by /flow:done, /flow:bug-rca, /flow:bug-fix to optionally create or update tickets.",
          "properties": {
            "provider": {
              "type": "string",
              "enum": [
                "clickup",
                "linear",
                "github",
                "jira",
                "notion",
                "asana",
                "shortcut",
                "none"
              ],
              "default": "none"
            },
            "mcp": {
              "type": "string",
              "description": "MCP tool name prefix used to call the provider (e.g. `mcp__claude_ai_ClickUp`, `mcp__github`). Generic commands resolve tool names by appending the operation (`<mcp>_<op>`). Omit if no MCP server is configured — commands will print payloads for manual handling."
            },
            "defaults": {
              "type": "object",
              "description": "Free-form project-specific defaults (list IDs, milestone names, custom field IDs, status labels, …). Generic commands pass this object through to MCP calls untouched. Schema-free on purpose — your tracker's idiosyncrasies belong here, not in the plugin.",
              "additionalProperties": true
            }
          }
        },
        "analytics": {
          "type": "object",
          "additionalProperties": false,
          "description": "Product analytics provider (PostHog, Amplitude, Mixpanel, …). Currently informational — surfaces in scenario reports and DDRs as context.",
          "properties": {
            "provider": { "type": "string", "default": "none" },
            "mcp": { "type": "string" },
            "defaults": { "type": "object", "additionalProperties": true }
          }
        },
        "ci": {
          "type": "object",
          "additionalProperties": false,
          "description": "CI / deploy provider (GitHub Actions, Vercel, Netlify, EAS, …). Used by /flow:validate to know where to look for build status.",
          "properties": {
            "provider": { "type": "string", "default": "none" },
            "mcp": { "type": "string" },
            "defaults": { "type": "object", "additionalProperties": true }
          }
        },
        "design": {
          "type": "object",
          "additionalProperties": false,
          "description": "Design source-of-truth (Figma, Penpot, Sketch, …). Used by /flow:plan when the planning input references design.",
          "properties": {
            "provider": { "type": "string", "default": "none" },
            "mcp": { "type": "string" },
            "defaults": { "type": "object", "additionalProperties": true }
          }
        },
        "changelog": {
          "type": "object",
          "additionalProperties": false,
          "description": "Release-note / changelog tooling. Used by /flow:validate and /flow:done to remind (soft warning) about missing release notes, by /flow:release-changelog to author entries, and by /flow:release to walk the project-owned release runbook. Phase 3 implements the `changesets` provider; other enum values are accepted but treated as no-op until their providers land.",
          "properties": {
            "provider": {
              "type": "string",
              "enum": ["changesets", "git-cliff", "conventional", "custom", "none"],
              "default": "none"
            },
            "scope": {
              "type": "string",
              "description": "Optional package scope for monorepos — e.g. \"@1agh/maude\". Passed to provider commands when they need to target a workspace member."
            },
            "releaseGuide": {
              "type": "string",
              "default": ".ai/release-guide.md",
              "description": "Path (repo-relative) to the project-owned release runbook that /flow:release walks step-by-step. The runbook is plain Markdown — H2 sections become steps, ```bash``` blocks become candidate commands (run only after user confirmation). Scaffolded with a provider-appropriate stub during /flow:init."
            },
            "mcp": { "type": "string" },
            "defaults": { "type": "object", "additionalProperties": true }
          }
        }
      }
    }
  }
}
